D;S;E;I;Cod
Participación política;Participación ciudadana;“Durante los últimos 12 meses,  con cuánta frecuencia usted ha ...”;Firmado una carta o petición apoyando una causa;c08_01
Participación política;Participación ciudadana;“Durante los últimos 12 meses,  con cuánta frecuencia usted ha ...”;Asistido a una marcha o manifestación política;c08_02
Participación política;Participación ciudadana;“Durante los últimos 12 meses,  con cuánta frecuencia usted ha ...”;Participado en una huelga;c08_03
Participación política;Participación ciudadana;“Durante los últimos 12 meses,  con cuánta frecuencia usted ha ...”;Usado las redes sociales para expresar su opinión en temas público;c08_04
Participación política;Interés político;¿Qué tan interesado está usted en la política?;;c13
Participación política;Interés político;¿Con qué frecuencia realiza usted las siguientes actividades?;Habla de política con familiares o amigos;c14_01
Participación política;Interés político;¿Con qué frecuencia realiza usted las siguientes actividades?;Se informa activamente sobre política en medios tales como televisión, radios, diarios o internet;c14_02
